date,study,study_link,journal,severe,severe_lower_bound,severe_upper_bound,severe_p-value,severe_significant,fatality,fatality_lower_bound,fatality_upper_bound,fatality_p-value,fatality_significant,fatality_adjusted,fatality_calculated,multivariate_adjustment,study_type,sample_size,study_population,critical_only,discharged_vs._death?,key_word,Severe_number,Fatality_number,severe_outside_bounds,fatality_outside_bounds,context
2020-03-11,"Clinical course and risk factors for mortality of adult inpatients with COVID-19 in Wuhan, China: a retrospective cohort study",https://www.thelancet.com/journals/lancet/article/PIIS0140-6736(20)30566-3/fulltext,The Lancet,,,,,,AOR=1.10,1.03,1.17,<0.05,Significant,Adjusted,Extracted,Age; CHD; SOFA score,Retrospective observational study,191,"Jinyintan Hospital and Wuhan Pulmonary Hospital (Wuhan, China) from Dec 29, 2020 to Jan 31, 2020",N,Y,[],,1.1,0,0,"Date: 2020-03-11. Study: Clinical course and risk factors for mortality of adult inpatients with COVID-19 in Wuhan, China: a retrospective cohort study. Study Link: https://www.thelancet.com/journals/lancet/article/PIIS0140-6736(20)30566-3/fulltext. Journal: The Lancet. Severe: nan. Severe Lower Bound: nan. Severe Upper Bound: nan. Severe p-value: nan. Severe Significant: nan. Fatalyty : AOR=1.10. Fatality lower bound : 1.03. Fatality upper bound: 1.17. Fatality p-value: <0.05. Fatality Significant: Significant. Fatality Adjusted: Adjusted. Fatality Calculated: Extracted. Multivariate Adjustment: Age; CHD; SOFA score. Study Type: Retrospective observational study. Sample Size: 191. Study Population: Jinyintan Hospital and Wuhan Pulmonary Hospital (Wuhan, China) from Dec 29, 2020 to Jan 31, 2020. Critical Only: N. Discharged vs Death: Y.Severe_number: nan. Fatality_number: 1.1. Severe_outside_bounds: 0. Fatality_outside_bounds: 0. Key word: []. "
2020-03-11,"Clinical course and risk factors for mortality of adult inpatients with COVID-19 in Wuhan, China: a retrospective cohort study",https://www.thelancet.com/journals/lancet/article/PIIS0140-6736(20)30566-3/fulltext,The Lancet,,,,,,OR=1.14,1.09,1.18,<0.05,Significant,Not Adjusted,Extracted,,Retrospective observational study,191,"Jinyintan Hospital and Wuhan Pulmonary Hospital (Wuhan, China) from Dec 29, 2020 to Jan 31, 2020",N,Y,[],,1.14,0,0,"Date: 2020-03-11. Study: Clinical course and risk factors for mortality of adult inpatients with COVID-19 in Wuhan, China: a retrospective cohort study. Study Link: https://www.thelancet.com/journals/lancet/article/PIIS0140-6736(20)30566-3/fulltext. Journal: The Lancet. Severe: nan. Severe Lower Bound: nan. Severe Upper Bound: nan. Severe p-value: nan. Severe Significant: nan. Fatalyty : OR=1.14. Fatality lower bound : 1.09. Fatality upper bound: 1.18. Fatality p-value: <0.05. Fatality Significant: Significant. Fatality Adjusted: Not Adjusted. Fatality Calculated: Extracted. Multivariate Adjustment: nan. Study Type: Retrospective observational study. Sample Size: 191. Study Population: Jinyintan Hospital and Wuhan Pulmonary Hospital (Wuhan, China) from Dec 29, 2020 to Jan 31, 2020. Critical Only: N. Discharged vs Death: Y.Severe_number: nan. Fatality_number: 1.14. Severe_outside_bounds: 0. Fatality_outside_bounds: 0. Key word: []. "
2020-03-06,Analysis of myocardial injury in patients with COVID-19 and association between concomitant cardiovascular diseases and severity of COVID-19,https://www.ncbi.nlm.nih.gov/pubmed/32141280,Chinese Journal of Cardiovascular Diseases,AOR 1.02,0.96,1.08,0.52,Not Significant,,,,,,,,"gender, hypertension, history of heart disease, N-terminal pro-B-type natriuretic peptide, cardiac troponin I, hypersensitive C-reactive protein, blood creatine",Cross-sectional study,150,"Tongji Hospital, excluding those with acute myocardial infarction",N,N,"['disease', 'patients', 'elevated', 'critical', 'ctni']",1.02,,0,0,"Date: 2020-03-06. Study: Analysis of myocardial injury in patients with COVID-19 and association between concomitant cardiovascular diseases and severity of COVID-19. Study Link: https://www.ncbi.nlm.nih.gov/pubmed/32141280. Journal: Chinese Journal of Cardiovascular Diseases. Severe: AOR 1.02. Severe Lower Bound: 0.96. Severe Upper Bound: 1.08. Severe p-value: 0.52. Severe Significant: Not Significant. Fatalyty : nan. Fatality lower bound : nan. Fatality upper bound: nan. Fatality p-value: nan. Fatality Significant: nan. Fatality Adjusted: nan. Fatality Calculated: nan. Multivariate Adjustment: gender, hypertension, history of heart disease, N-terminal pro-B-type natriuretic peptide, cardiac troponin I, hypersensitive C-reactive protein, blood creatine. Study Type: Cross-sectional study. Sample Size: 150. Study Population: Tongji Hospital, excluding those with acute myocardial infarction. Critical Only: N. Discharged vs Death: N.Severe_number: 1.02. Fatality_number: nan. Severe_outside_bounds: 0. Fatality_outside_bounds: 0. Key word: ['disease', 'patients', 'elevated', 'critical', 'ctni']. "
2020-03-06,Analysis of myocardial injury in patients with COVID-19 and association between concomitant cardiovascular diseases and severity of COVID-19,https://www.ncbi.nlm.nih.gov/pubmed/32141280,Chinese Journal of Cardiovascular Diseases,OR 1.06,1.02,1.09,<0.01,Significant,,,,,,,,,Cross-sectional study,150,"Tongji Hospital, excluding those with acute myocardial infarction",N,N,"['disease', 'patients', 'elevated', 'critical', 'ctni']",1.06,,0,0,"Date: 2020-03-06. Study: Analysis of myocardial injury in patients with COVID-19 and association between concomitant cardiovascular diseases and severity of COVID-19. Study Link: https://www.ncbi.nlm.nih.gov/pubmed/32141280. Journal: Chinese Journal of Cardiovascular Diseases. Severe: OR 1.06. Severe Lower Bound: 1.02. Severe Upper Bound: 1.09. Severe p-value: <0.01. Severe Significant: Significant. Fatalyty : nan. Fatality lower bound : nan. Fatality upper bound: nan. Fatality p-value: nan. Fatality Significant: nan. Fatality Adjusted: nan. Fatality Calculated: nan. Multivariate Adjustment: nan. Study Type: Cross-sectional study. Sample Size: 150. Study Population: Tongji Hospital, excluding those with acute myocardial infarction. Critical Only: N. Discharged vs Death: N.Severe_number: 1.06. Fatality_number: nan. Severe_outside_bounds: 0. Fatality_outside_bounds: 0. Key word: ['disease', 'patients', 'elevated', 'critical', 'ctni']. "
2020-03-06,Case fatality risk of novel coronavirus diseases 2019 in China,https://doi.org/10.1101/2020.03.04.20031005,medRxiv,,,,,,OR 1.18,1.14,1.22,<0.01,Significant,Adjusted,Extracted,,Cross-sectional study,9651,The National Health Commission of China (NHC) and the Chinese Center for Disease Control and Prevention (China CDC),N,N,"['author', 'health', 'find', 'public', 'china']",,1.18,0,0,"Date: 2020-03-06. Study: Case fatality risk of novel coronavirus diseases 2019 in China. Study Link: https://doi.org/10.1101/2020.03.04.20031005. Journal: medRxiv. Severe: nan. Severe Lower Bound: nan. Severe Upper Bound: nan. Severe p-value: nan. Severe Significant: nan. Fatalyty : OR 1.18. Fatality lower bound : 1.14. Fatality upper bound: 1.22. Fatality p-value: <0.01. Fatality Significant: Significant. Fatality Adjusted: Adjusted. Fatality Calculated: Extracted. Multivariate Adjustment: nan. Study Type: Cross-sectional study. Sample Size: 9651. Study Population: The National Health Commission of China (NHC) and the Chinese Center for Disease Control and Prevention (China CDC). Critical Only: N. Discharged vs Death: N.Severe_number: nan. Fatality_number: 1.18. Severe_outside_bounds: 0. Fatality_outside_bounds: 0. Key word: ['author', 'health', 'find', 'public', 'china']. "
2020-03-03,"Epidemiological and clinical features of COVID-19 patients with and without pneumonia in Beijing, China",https://www.medrxiv.org/content/10.1101/2020.02.28.20028068v1.full.pdf,medRxiv,,,,,,,,,,,,,,Retrospective observational study,55,"Fifth Medical Center of PLA General Hospital from December 27, 2019 to February 18, 2020",N,N,"['preprint', 'patients', 'license', 'medrxiv', 'pneumonia']",,,0,0,"Date: 2020-03-03. Study: Epidemiological and clinical features of COVID-19 patients with and without pneumonia in Beijing, China. Study Link: https://www.medrxiv.org/content/10.1101/2020.02.28.20028068v1.full.pdf. Journal: medRxiv. Severe: nan. Severe Lower Bound: nan. Severe Upper Bound: nan. Severe p-value: nan. Severe Significant: nan. Fatalyty : nan. Fatality lower bound : nan. Fatality upper bound: nan. Fatality p-value: nan. Fatality Significant: nan. Fatality Adjusted: nan. Fatality Calculated: nan. Multivariate Adjustment: nan. Study Type: Retrospective observational study. Sample Size: 55. Study Population: Fifth Medical Center of PLA General Hospital from December 27, 2019 to February 18, 2020. Critical Only: N. Discharged vs Death: N.Severe_number: nan. Fatality_number: nan. Severe_outside_bounds: 0. Fatality_outside_bounds: 0. Key word: ['preprint', 'patients', 'license', 'medrxiv', 'pneumonia']. "
2020-03-03,Epidemiological and clinical features of 2019-nCoV acute respiratory disease cases in Chongqing municipality China: a retrospective descriptive multiple-center study,https://doi.org/10.1101/2020.03.01.20029397,medRxiv,,,,,,,,,,,,,,Retrospective observational study,267,"Qianjiang central hospital of Chongqing, Chongqing three gorges central hospital and Chongqing public health medical center from January 19 to February 16, 2021",N,N,"['author', 'chongqing', 'find', 'china', 'patients']",,,0,0,"Date: 2020-03-03. Study: Epidemiological and clinical features of 2019-nCoV acute respiratory disease cases in Chongqing municipality China: a retrospective descriptive multiple-center study. Study Link: https://doi.org/10.1101/2020.03.01.20029397. Journal: medRxiv. Severe: nan. Severe Lower Bound: nan. Severe Upper Bound: nan. Severe p-value: nan. Severe Significant: nan. Fatalyty : nan. Fatality lower bound : nan. Fatality upper bound: nan. Fatality p-value: nan. Fatality Significant: nan. Fatality Adjusted: nan. Fatality Calculated: nan. Multivariate Adjustment: nan. Study Type: Retrospective observational study. Sample Size: 267. Study Population: Qianjiang central hospital of Chongqing, Chongqing three gorges central hospital and Chongqing public health medical center from January 19 to February 16, 2021. Critical Only: N. Discharged vs Death: N.Severe_number: nan. Fatality_number: nan. Severe_outside_bounds: 0. Fatality_outside_bounds: 0. Key word: ['author', 'chongqing', 'find', 'china', 'patients']. "
2020-05-15,Risk factors for clinical progression in patients with COVID-19: a retrospective study of electronic health record data in the United Kingdom,http://medrxiv.org/cgi/content/short/2020.05.11.20093096v1?rss=1,MedRxiv,AOR=0.97,0.96,0.99,<0.05,Significant,AOR=1.06,1.04,1.06,<0.05,Significant,Adjusted,Extracted,Age; Ethnicity; Laboratory values; Vital signs,Retrospective observational study,3753,Emergency department of Chelsea & Westminster Hospital NHS Foundation Trust between 1st January 2020 and 23rd April 2020,Y,N,"['patients', 'covid', 'preprint', 'ci', 'per']",0.97,1.06,0,0,"Date: 2020-05-15. Study: Risk factors for clinical progression in patients with COVID-19: a retrospective study of electronic health record data in the United Kingdom. Study Link: http://medrxiv.org/cgi/content/short/2020.05.11.20093096v1?rss=1. Journal: MedRxiv. Severe: AOR=0.97. Severe Lower Bound: 0.96. Severe Upper Bound: 0.99. Severe p-value: <0.05. Severe Significant: Significant. Fatalyty : AOR=1.06. Fatality lower bound : 1.04. Fatality upper bound: 1.06. Fatality p-value: <0.05. Fatality Significant: Significant. Fatality Adjusted: Adjusted. Fatality Calculated: Extracted. Multivariate Adjustment: Age; Ethnicity; Laboratory values; Vital signs. Study Type: Retrospective observational study. Sample Size: 3753. Study Population: Emergency department of Chelsea & Westminster Hospital NHS Foundation Trust between 1st January 2020 and 23rd April 2020. Critical Only: Y. Discharged vs Death: N.Severe_number: 0.97. Fatality_number: 1.06. Severe_outside_bounds: 0. Fatality_outside_bounds: 0. Key word: ['patients', 'covid', 'preprint', 'ci', 'per']. "
2020-05-15,Clinical Presentation of COVID19 in Dementia Patients,https://www.ncbi.nlm.nih.gov/pubmed/32425646/,J Nutr Health Aging,,,,,,OR=1.09,1.07,1.12,<0.05,Significant,Adjusted,Extracted,Age; Sex; Dementia,Retrospective observational study,82,"Respiratory failure patients in COVID wards in Acute Hospital in Brescia province, Northern Italy.",N,N,"['transmission', 'local', 'cases', 'covid', 'imported']",,1.09,0,0,"Date: 2020-05-15. Study: Clinical Presentation of COVID19 in Dementia Patients. Study Link: https://www.ncbi.nlm.nih.gov/pubmed/32425646/. Journal: J Nutr Health Aging. Severe: nan. Severe Lower Bound: nan. Severe Upper Bound: nan. Severe p-value: nan. Severe Significant: nan. Fatalyty : OR=1.09. Fatality lower bound : 1.07. Fatality upper bound: 1.12. Fatality p-value: <0.05. Fatality Significant: Significant. Fatality Adjusted: Adjusted. Fatality Calculated: Extracted. Multivariate Adjustment: Age; Sex; Dementia. Study Type: Retrospective observational study. Sample Size: 82. Study Population: Respiratory failure patients in COVID wards in Acute Hospital in Brescia province, Northern Italy.. Critical Only: N. Discharged vs Death: N.Severe_number: nan. Fatality_number: 1.09. Severe_outside_bounds: 0. Fatality_outside_bounds: 0. Key word: ['transmission', 'local', 'cases', 'covid', 'imported']. "
