,Date,Study,Study Link,Journal,Study Type,Material,Method,Days After Onset/Admission (+) Covid-19 Presence (maximum unless otherwise stated),Property 2,Conclusion,Measure of Evidence,Added on
0,2020-03-30,Virus shedding patterns in nasopharyngeal and fecal specimens of COVID-19 patients,https://www.medrxiv.org/content/10.1101/2020.03.28.20043059v1,medRxiv,Prospective Cohort,Urine,RT-PCR confirmed,range: 16-21,-,"urine samples were all negative, except for urine samples from two severe cases at the latest available detection point (16 or 21 d.a.o).",patients: 23,04/08/2020
1,2020-03-26,Viral Kinetics and Antibody Responses in Patients with COVID-19,https://www.medrxiv.org/content/10.1101/2020.03.24.20042382v1,medRxiv,Prospective Cohort,Urine,RT-PCR confirmed,-,-,"Among the 231 urines and 211 plasmas collected from 67 patients, only 13 urines (5.6%) from 12 patients (18.8%) and 12 plasmas (5.7%) from 9 patients (14.3%) were positive for SARS-CoV-2 RNA",patients: 67,04/08/2020
2,2020-03-03,Epidemiologic Features and Clinical Course of Patients Infected With SARS-CoV-2 in Singapore,https://jamanetwork.com/journals/jama/fullarticle/2762688,JAMA,Descriptive case series,Urine,RT-PCR confirmed,-,-,virus was not detected in urine (0/10 samples),patients: 10,04/08/2020
3,2020-05-16,COVID-19-associated nephritis: early warning for disease severity and complications?,https://www.thelancet.com/journals/lancet/article/PIIS0140-6736(20)31041-2/fulltext,Lancet,Descriptive case series,Urine,RT-PCR confirmed,-,-,"Three of these patients had coincidentally submitted urine samples in the few weeks before their infection with severe acute respiratory syndrome coronavirus 2 (SARS-CoV-2). These urine samples had been normal. However, on March 21, 2020, since becoming infected with SARS-CoV-2, the urine sample of one of these three patients was also positive for SARS-CoV-2 RNA.",patients: 3,05/27/2020
4,2020-03-11,Detection of SARS-CoV-2 in Different Types of Clinical Specimens,https://jamanetwork.com/journals/jama/fullarticle/2762997,JAMA,Retrospective cohort,Urine,RT-PCR confirmed,-,-,None of the 72 urine specimens tested positive,patients: 72,05/27/2020
