,Date,Study,Study Link,Journal,Severe,Severe lower bound,Severe upper bound,Severe p-value,Severe Significant,Severe Adjusted,Severe Calculated,Fatality,Fatality lower bound,Fatality upper bound,Fatality p-value,Fatality Significant,Fatality Adjusted,Fatality Calculated,Multivariate adjustment,Study Type,Sample Size,Study Population,Added on,Critical only?,Discharged vs. death?
0,2020-06-01,COVID-19 with Different Severities: A Multicenter Study of Clinical Features,https://www.ncbi.nlm.nih.gov/pubmed/32275452/,Am J Respir Crit Care Med,OR 2.72,1.28,5.81,0.01,Significant,Not Adjusted,Calculated,,,,,,,,,Retrospective observational study,476.0,"Jinyintan Hospital in Wuhan, Shanghai Public Health Clinical Center in Shanghai, and Tongling People’s Hospital in Anhui Province, China from January 1, 2020, to February 15, 2020.",,Y,N
1,2020-05-26,"Characteristics and predictors of hospitalization and death in the first 9,519 cases with a positive RT-PCR test for SARS-CoV-2 in Denmark: A nationwide cohort",http://medrxiv.org/cgi/content/short/2020.05.24.20111823v1?rss=1,MedRxiv,,,,,,,,AOR=1.6,1.1,2.5,,Significant,Adjusted,Extracted,Age; Sex,Retrospective observational study,9519.0,"Danish SARS-CoV-2 cohort from February 27th, 2020 to April 30th, 2020",,Y,N
2,2020-05-26,"Characteristics and predictors of hospitalization and death in the first 9,519 cases with a positive RT-PCR test for SARS-CoV-2 in Denmark: A nationwide cohort",http://medrxiv.org/cgi/content/short/2020.05.24.20111823v1?rss=1,MedRxiv,OR 0.96,0.55,1.68,0.89,Not Significant,Not Adjusted,Calculated,OR=2.5,1.8,3.7,,Significant,Not Adjusted,Extracted,,Retrospective observational study,9519.0,"Danish SARS-CoV-2 cohort from February 27th, 2020 to April 30th, 2020",,Y,N
3,2020-05-13,"Epidemiological and clinical characteristics of 333 confirmed cases with coronavirus disease 2019 in Shanghai, China",https://www.ncbi.nlm.nih.gov/pubmed/32351037/,Transbound Emerg Dis,OR 0.72,0.26,1.99,0.53,Not Significant,Not Adjusted,Calculated,,,,,,,,,Retrospective observational study,333.0,"Center for Disease Control and Prevention in Shanghai as of February 19, 2020",,N,N
4,2020-02-12,Neutrophil-to-Lymphocyte Ratio Predicts Severe Illness Patients with 2019 Novel Coronavirus in the Early Stage,https://doi.org/10.1101/2020.02.10.20021584,medRxiv,OR 2.88,0.8,10.38,0.11,Not Significant,Not Adjusted,Calculated,,,,,,,,,Prospective observational study,61.0,"Beijing Ditan Hospital from January 13, 2020 to January 31, 2020",4/10/2020,Y,N
